{
  "_comment": "Canonical axis contract for FlexTool's pl.Enum dtype activation. Migrates hand-in-hand with flextool_template_master.json. See specs/enum_dtype_refactor_plan.md and version/AXIS_CONTRACT.md.",
  "_doc": "version/AXIS_CONTRACT.md",
  "_schema_version": "1.0.0",
  "_template_master_version_compat": {
    "path": "version/flextool_template_master.json",
    "git_commit": "52df156c631443814246918051f68f8ae4d36571",
    "git_commit_date": "2026-05-12 20:40:54 +0300",
    "note": "Verified during Phase 0. Bump these fields when flextool_template_master.json changes in a way that affects axes (new/renamed/removed entity classes or parameter definitions referenced below)."
  },
  "axes": [
    {
      "name": "n",
      "label": "node",
      "source_type": "entity_class",
      "source": "node",
      "filter": "scenario_filter",
      "column_synonyms": ["node"],
      "note": "Node entities. Cascade column synonym: 'node' (renamed to 'n' in most helpers; see flextool/engine_polars/_axis_enums.py _AXIS_SYNONYMS)."
    },
    {
      "name": "p",
      "label": "process",
      "source_type": "entity_class_union",
      "source": ["unit", "connection"],
      "filter": "scenario_filter",
      "column_synonyms": ["process"],
      "note": "FlexTool convention: 'process' = unit ∪ connection. Cascade column synonym: 'process'."
    },
    {
      "name": "c",
      "label": "commodity",
      "source_type": "entity_class",
      "source": "commodity",
      "filter": "scenario_filter",
      "column_synonyms": ["commodity"],
      "note": "Commodity entities. WARNING: the cascade letter 'c' is overloaded — _direct_params._node_constraint_coef and _process_constraint_coef rename constraint→c (see review_notes.c_collision). Phase 1 build_axis_enums must decide whether to (a) rename the constraint column to 'cn' in those helpers or (b) split into two enums under different column names. The contract here documents the commodity vocabulary; the constraint axis is registered separately below."
    },
    {
      "name": "g",
      "label": "group",
      "source_type": "entity_class",
      "source": "group",
      "filter": "scenario_filter",
      "column_synonyms": ["group"]
    },
    {
      "name": "f",
      "label": "profile",
      "source_type": "entity_class",
      "source": "profile",
      "filter": "scenario_filter"
    },
    {
      "name": "d",
      "label": "period",
      "source_type": "parameter_keys",
      "source": {
        "entity_class": "solve",
        "parameters": ["years_represented", "realized_periods", "invest_periods", "realized_invest_periods"],
        "depth": 1,
        "key_kind": "union_keys_and_array_values",
        "additional_sources": [
          {"entity_class": "unit",       "parameter": "invest_max_period"},
          {"entity_class": "unit",       "parameter": "invest_min_period"},
          {"entity_class": "connection", "parameter": "invest_max_period"},
          {"entity_class": "connection", "parameter": "invest_min_period"},
          {"entity_class": "node",       "parameter": "invest_max_period"},
          {"entity_class": "node",       "parameter": "invest_min_period"},
          {"entity_class": "group",      "parameter": "invest_max_period"},
          {"entity_class": "group",      "parameter": "invest_min_period"}
        ]
      },
      "filter": "∩ realized_periods of the active model instance",
      "column_synonyms": ["period", "d_invest", "d_divest", "d_previous", "d_upper", "d_back"],
      "note": "FlexTool 'period' axis. Primary sources: keys of solve.years_represented (Map), values of solve.realized_periods (Array), keys of solve.invest_periods (Map), keys of solve.realized_invest_periods (Map). Phase 4 — also unions keys from entity-level invest_max_period / invest_min_period maps (unit / connection / node / group) because scenario filters can narrow solve.invest_periods to a subset while leaving entity-level period maps untouched; the cast at the Backend emit boundary needs the full vocabulary so cross-scenario period references don't raise FlexDataIntegrityError on a legitimate inactive-this-solve token. NOT 'timeline' — the earlier audit reported source=timeline but the cascade renames period→d at every reader (e.g. _derived_block.py:169/180, _derived_branch.py:150, _invest_seeds.py:80/107). The 'period' is a logical year/horizon label, distinct from the timeline (timestep grid)."
    },
    {
      "name": "e",
      "label": "investable_entity",
      "source_type": "entity_class_union",
      "source": ["node", "unit", "connection"],
      "filter": "scenario_filter",
      "column_synonyms": ["entity"],
      "note": "Union of node + process. Used in investment params and any frame mixing node and process names (source/sink). The substrate _AXIS_SYNONYMS already maps the column 'entity' → 'e', so 'e' IS the canonical entity-union axis. The separate 'entity' axis row in earlier drafts was a duplicate; consolidated here."
    },
    {
      "name": "t",
      "label": "timestep",
      "source_type": "parameter_keys",
      "source": {
        "entity_class": "timeline",
        "parameter": "timestep_duration",
        "depth": 1
      },
      "filter": "∩ timeset.period_timestep values; union across active timelines",
      "column_synonyms": [
        "step",
        "t_previous", "t_previous_within_block", "t_previous_within_timeset", "t_previous_within_solve",
        "t_upper", "t_back", "t_source", "t_sink",
        "b_first", "b_next"
      ],
      "note": "Vocabulary = keys of timeline.timestep_duration map. Per-timeline; union across active timelines if multiple are active in the model instance. 'b_first' and 'b_next' are confusingly named — they are cardinal timestep synonyms (the FIRST timestep of a coarse block) NOT 'block' axis values; see _derived_block.py:601-625."
    },
    {
      "name": "i",
      "label": "tier_index",
      "source_type": "parameter_keys",
      "source": {
        "entity_class": "commodity",
        "parameter_prefix": "price_ladder_",
        "depth": "discover"
      },
      "filter": null,
      "note": "Integer tier indices serialised as strings ('1', '2', …, 'N'). N discovered from max map depth across commodity.price_ladder_* parameters. Phase 1 build_axis_enums must inspect the runtime depth and emit a fixed-N enum."
    },
    {
      "name": "branch",
      "label": "stochastic_branch",
      "source_type": "parameter_value_list",
      "source": {
        "entity_class": "solve",
        "parameter": "stochastic_branches"
      },
      "filter": "gated by solve.include_stochastics",
      "column_synonyms": ["b"],
      "note": "Stochastic branch labels. The cascade column is 'b' (renamed from 'branch' in _derived_branch.py:150). WARNING: 'b' is overloaded — _derived_block.py / _block_layout.py also use 'b' for the BLOCK axis (see 'block' axis below). The two never appear in the same frame, but Phase 1 must decide on a disambiguation (e.g. rename block→bk in block helpers, or rename branch→br). See review_notes.b_collision. Empty enum is valid (deterministic runs)."
    },
    {
      "name": "block",
      "label": "block",
      "source_type": "parameter_keys",
      "source": {
        "entity_class": "group",
        "parameter": "new_stepduration",
        "depth": "discover",
        "key_kind": "values_plus_default"
      },
      "filter": "active blocks for the solve (includes synthetic DEFAULT_BLOCK)",
      "column_synonyms": ["bk"],
      "tokens_default_extension": ["default"],
      "note": "Block names are derived in _block_layout.py from 'group' entities that carry a new_stepduration parameter, plus a synthetic DEFAULT_BLOCK fallback. Vocabulary = group names participating as resolution blocks ∪ {DEFAULT_BLOCK}. Phase 1 resolved the b_collision review note by renaming the cascade column from 'b' to 'bk' in _derived_block.py / _block_layout.py / input.py block-aware filters. The companion 'b_f' (block-fine) column also carries block vocabulary but is a distinct column name and does not collide."
    },
    {
      "name": "r",
      "label": "reserve",
      "source_type": "entity_class",
      "source": "reserve",
      "filter": "scenario_filter",
      "note": "Reserve entities. Cascade column: 'r' (renamed from 'reserve' in _reserve.py:160 and downstream)."
    },
    {
      "name": "ud",
      "label": "up_or_down",
      "source_type": "synthetic",
      "source": null,
      "tokens": ["up", "down"],
      "filter": null,
      "note": "Fixed 2-value axis. Substrate of the schema is the 'upDown' entity class which has exactly two members ('up', 'down') — treated as synthetic to make the contract independent of the entity-class table for these two fixed tokens. Cascade column: 'ud' (renamed from 'upDown' in _reserve.py:160)."
    },
    {
      "name": "constraint",
      "label": "constraint",
      "source_type": "entity_class",
      "source": "constraint",
      "filter": "scenario_filter",
      "column_synonyms": ["cn"],
      "note": "User-defined constraints. Phase 1 resolved the c-collision review note by renaming the constraint column from 'c' to 'cn' across _direct_params, _projection_params, input.py (_load_user_constraints), _derived_params (p_flow_constraint_coef_from_source) and model.py. The constraint axis now lives under the 'cn' column name and never collides with the commodity 'c' column."
    },
    {
      "name": "d_anchor",
      "label": "branch_anchor_period",
      "source_type": "parameter_keys",
      "source": {
        "carrier": "period__branch",
        "column": "d_anchor"
      },
      "filter": "subset of 'd' when stochastic",
      "note": "Only populated when stochastic. Vocabulary = distinct anchor periods in the per-solve period__branch carrier. Derived; not a schema axis."
    },
    {
      "name": "side",
      "label": "flow_side",
      "source_type": "synthetic",
      "source": null,